[
  {
    "id": "V3_HOME_001",
    "name": "Bright Homecoming · 01",
    "nameZh": "明亮归途 · 01",
    "nameEn": "Bright Homecoming · 01",
    "aliases": "明亮归途,Bright Homecoming",
    "builtInTags": "common-major,resolve",
    "techniques": "",
    "complexityLevel": "basic",
    "description": "明亮归途；完整乐句，按所示和弦时值展开。",
    "mode": "major",
    "sequence": "I ii IV V I",
    "rhythm": "4 4 4 4 4",
    "intent": "resolve",
    "cadence": "authentic",
    "loopable": false,
    "meter": "4/4",
    "styles": "pop:0.8,functional:0.9",
    "tags": "common-major",
    "sourceType": "factory",
    "priorWeight": 0.5,
    "complexity": 0.25,
    "version": 3,
    "phraseLength": 5
  },
  {
    "id": "V3_HOME_002",
    "name": "Bright Homecoming · 02",
    "nameZh": "明亮归途 · 02",
    "nameEn": "Bright Homecoming · 02",
    "aliases": "明亮归途,Bright Homecoming",
    "builtInTags": "common-major,resolve",
    "techniques": "",
    "complexityLevel": "basic",
    "description": "明亮归途；完整乐句，按所示和弦时值展开。",
    "mode": "major",
    "sequence": "I IV vi ii V I",
    "rhythm": "4 4 4 4 4 4",
    "intent": "resolve",
    "cadence": "authentic",
    "loopable": false,
    "meter": "4/4",
    "styles": "pop:0.8,functional:0.9",
    "tags": "common-major",
    "sourceType": "factory",
    "priorWeight": 0.5,
    "complexity": 0.25,
    "version": 3,
    "phraseLength": 6
  },
  {
    "id": "V3_HOME_003",
    "name": "Bright Homecoming · 03",
    "nameZh": "明亮归途 · 03",
    "nameEn": "Bright Homecoming · 03",
    "aliases": "明亮归途,Bright Homecoming",
    "builtInTags": "common-major,resolve",
    "techniques": "",
    "complexityLevel": "basic",
    "description": "明亮归途；完整乐句，按所示和弦时值展开。",
    "mode": "major",
    "sequence": "I vi IV ii V I",
    "rhythm": "4 4 4 4 4 4",
    "intent": "resolve",
    "cadence": "authentic",
    "loopable": false,
    "meter": "4/4",
    "styles": "pop:0.8,functional:0.9",
    "tags": "common-major",
    "sourceType": "factory",
    "priorWeight": 0.5,
    "complexity": 0.25,
    "version": 3,
    "phraseLength": 6
  },
  {
    "id": "V3_HOME_004",
    "name": "Bright Homecoming · 04",
    "nameZh": "明亮归途 · 04",
    "nameEn": "Bright Homecoming · 04",
    "aliases": "明亮归途,Bright Homecoming",
    "builtInTags": "common-major,resolve",
    "techniques": "",
    "complexityLevel": "basic",
    "description": "明亮归途；完整乐句，按所示和弦时值展开。",
    "mode": "major",
    "sequence": "I iii IV ii V I",
    "rhythm": "4 4 4 4 4 4",
    "intent": "resolve",
    "cadence": "authentic",
    "loopable": false,
    "meter": "4/4",
    "styles": "pop:0.8,functional:0.9",
    "tags": "common-major",
    "sourceType": "factory",
    "priorWeight": 0.5,
    "complexity": 0.25,
    "version": 3,
    "phraseLength": 6
  },
  {
    "id": "V3_HOME_005",
    "name": "Bright Homecoming · 05",
    "nameZh": "明亮归途 · 05",
    "nameEn": "Bright Homecoming · 05",
    "aliases": "明亮归途,Bright Homecoming",
    "builtInTags": "common-major,resolve",
    "techniques": "",
    "complexityLevel": "basic",
    "description": "明亮归途；完整乐句，按所示和弦时值展开。",
    "mode": "major",
    "sequence": "I ii vi IV V I",
    "rhythm": "4 4 4 4 4 4",
    "intent": "resolve",
    "cadence": "authentic",
    "loopable": false,
    "meter": "4/4",
    "styles": "pop:0.8,functional:0.9",
    "tags": "common-major",
    "sourceType": "factory",
    "priorWeight": 0.5,
    "complexity": 0.25,
    "version": 3,
    "phraseLength": 6
  },
  {
    "id": "V3_HOME_006",
    "name": "Bright Homecoming · 06",
    "nameZh": "明亮归途 · 06",
    "nameEn": "Bright Homecoming · 06",
    "aliases": "明亮归途,Bright Homecoming",
    "builtInTags": "common-major,resolve,seventh_chord",
    "techniques": "SeventhColor",
    "complexityLevel": "rich",
    "description": "明亮归途；完整乐句，按所示和弦时值展开。",
    "mode": "major",
    "sequence": "I IV ii V7 I",
    "rhythm": "4 4 4 4 4",
    "intent": "resolve",
    "cadence": "authentic",
    "loopable": false,
    "meter": "4/4",
    "styles": "pop:0.8,functional:0.9",
    "tags": "common-major",
    "sourceType": "factory",
    "priorWeight": 0.5,
    "complexity": 0.45,
    "version": 3,
    "phraseLength": 5
  },
  {
    "id": "V3_HOME_007",
    "name": "Bright Homecoming · 07",
    "nameZh": "明亮归途 · 07",
    "nameEn": "Bright Homecoming · 07",
    "aliases": "明亮归途,Bright Homecoming",
    "builtInTags": "common-major,resolve,seventh_chord",
    "techniques": "SeventhColor",
    "complexityLevel": "rich",
    "description": "明亮归途；完整乐句，按所示和弦时值展开。",
    "mode": "major",
    "sequence": "I vi ii V7 I",
    "rhythm": "4 4 4 4 4",
    "intent": "resolve",
    "cadence": "authentic",
    "loopable": false,
    "meter": "4/4",
    "styles": "pop:0.8,functional:0.9",
    "tags": "common-major",
    "sourceType": "factory",
    "priorWeight": 0.5,
    "complexity": 0.45,
    "version": 3,
    "phraseLength": 5
  },
  {
    "id": "V3_HOME_008",
    "name": "Bright Homecoming · 08",
    "nameZh": "明亮归途 · 08",
    "nameEn": "Bright Homecoming · 08",
    "aliases": "明亮归途,Bright Homecoming",
    "builtInTags": "common-major,resolve",
    "techniques": "",
    "complexityLevel": "basic",
    "description": "明亮归途；完整乐句，按所示和弦时值展开。",
    "mode": "major",
    "sequence": "I iii vi IV V I",
    "rhythm": "4 4 4 4 4 4",
    "intent": "resolve",
    "cadence": "authentic",
    "loopable": false,
    "meter": "4/4",
    "styles": "pop:0.8,functional:0.9",
    "tags": "common-major",
    "sourceType": "factory",
    "priorWeight": 0.5,
    "complexity": 0.25,
    "version": 3,
    "phraseLength": 6
  },
  {
    "id": "V3_HOME_009",
    "name": "Bright Homecoming · 09",
    "nameZh": "明亮归途 · 09",
    "nameEn": "Bright Homecoming · 09",
    "aliases": "明亮归途,Bright Homecoming",
    "builtInTags": "common-major,resolve",
    "techniques": "",
    "complexityLevel": "basic",
    "description": "明亮归途；完整乐句，按所示和弦时值展开。",
    "mode": "major",
    "sequence": "I V vi ii V I",
    "rhythm": "4 4 4 4 4 4",
    "intent": "resolve",
    "cadence": "authentic",
    "loopable": false,
    "meter": "4/4",
    "styles": "pop:0.8,functional:0.9",
    "tags": "common-major",
    "sourceType": "factory",
    "priorWeight": 0.5,
    "complexity": 0.25,
    "version": 3,
    "phraseLength": 6
  },
  {
    "id": "V3_HOME_010",
    "name": "Bright Homecoming · 10",
    "nameZh": "明亮归途 · 10",
    "nameEn": "Bright Homecoming · 10",
    "aliases": "明亮归途,Bright Homecoming",
    "builtInTags": "common-major,resolve",
    "techniques": "",
    "complexityLevel": "basic",
    "description": "明亮归途；完整乐句，按所示和弦时值展开。",
    "mode": "major",
    "sequence": "I V IV ii V I",
    "rhythm": "4 4 4 4 4 4",
    "intent": "resolve",
    "cadence": "authentic",
    "loopable": false,
    "meter": "4/4",
    "styles": "pop:0.8,functional:0.9",
    "tags": "common-major",
    "sourceType": "factory",
    "priorWeight": 0.5,
    "complexity": 0.25,
    "version": 3,
    "phraseLength": 6
  },
  {
    "id": "V3_HOME_011",
    "name": "Bright Homecoming · 11",
    "nameZh": "明亮归途 · 11",
    "nameEn": "Bright Homecoming · 11",
    "aliases": "明亮归途,Bright Homecoming",
    "builtInTags": "common-major,resolve",
    "techniques": "",
    "complexityLevel": "basic",
    "description": "明亮归途；完整乐句，按所示和弦时值展开。",
    "mode": "major",
    "sequence": "I vi iii ii V I",
    "rhythm": "4 4 4 4 4 4",
    "intent": "resolve",
    "cadence": "authentic",
    "loopable": false,
    "meter": "4/4",
    "styles": "pop:0.8,functional:0.9",
    "tags": "common-major",
    "sourceType": "factory",
    "priorWeight": 0.5,
    "complexity": 0.25,
    "version": 3,
    "phraseLength": 6
  },
  {
    "id": "V3_HOME_012",
    "name": "Bright Homecoming · 12",
    "nameZh": "明亮归途 · 12",
    "nameEn": "Bright Homecoming · 12",
    "aliases": "明亮归途,Bright Homecoming",
    "builtInTags": "common-major,resolve",
    "techniques": "",
    "complexityLevel": "basic",
    "description": "明亮归途；完整乐句，按所示和弦时值展开。",
    "mode": "major",
    "sequence": "I iii ii V I",
    "rhythm": "4 4 4 4 4",
    "intent": "resolve",
    "cadence": "authentic",
    "loopable": false,
    "meter": "4/4",
    "styles": "pop:0.8,functional:0.9",
    "tags": "common-major",
    "sourceType": "factory",
    "priorWeight": 0.5,
    "complexity": 0.25,
    "version": 3,
    "phraseLength": 5
  },
  {
    "id": "V3_HOME_013",
    "name": "Bright Homecoming · 13",
    "nameZh": "明亮归途 · 13",
    "nameEn": "Bright Homecoming · 13",
    "aliases": "明亮归途,Bright Homecoming",
    "builtInTags": "common-major,resolve",
    "techniques": "",
    "complexityLevel": "basic",
    "description": "明亮归途；完整乐句，按所示和弦时值展开。",
    "mode": "major",
    "sequence": "I IV iii vi ii V I",
    "rhythm": "4 4 4 4 4 4 4",
    "intent": "resolve",
    "cadence": "authentic",
    "loopable": false,
    "meter": "4/4",
    "styles": "pop:0.8,functional:0.9",
    "tags": "common-major",
    "sourceType": "factory",
    "priorWeight": 0.5,
    "complexity": 0.25,
    "version": 3,
    "phraseLength": 7
  },
  {
    "id": "V3_HOME_014",
    "name": "Bright Homecoming · 14",
    "nameZh": "明亮归途 · 14",
    "nameEn": "Bright Homecoming · 14",
    "aliases": "明亮归途,Bright Homecoming",
    "builtInTags": "common-major,resolve",
    "techniques": "",
    "complexityLevel": "basic",
    "description": "明亮归途；完整乐句，按所示和弦时值展开。",
    "mode": "major",
    "sequence": "I ii iii IV V I",
    "rhythm": "4 4 4 4 4 4",
    "intent": "resolve",
    "cadence": "authentic",
    "loopable": false,
    "meter": "4/4",
    "styles": "pop:0.8,functional:0.9",
    "tags": "common-major",
    "sourceType": "factory",
    "priorWeight": 0.5,
    "complexity": 0.25,
    "version": 3,
    "phraseLength": 6
  },
  {
    "id": "V3_HOME_015",
    "name": "Bright Homecoming · 15",
    "nameZh": "明亮归途 · 15",
    "nameEn": "Bright Homecoming · 15",
    "aliases": "明亮归途,Bright Homecoming",
    "builtInTags": "common-major,resolve,seventh_chord",
    "techniques": "SeventhColor",
    "complexityLevel": "rich",
    "description": "明亮归途；完整乐句，按所示和弦时值展开。",
    "mode": "major",